<?xml version="1.0" encoding="UTF-8"?>
<processus name="MonService" xmlns:xsi="http://www.w3.org/2001/XMLSchema-instance" xsi:noNamespaceSchemaLocation="TamagoACA.xsd">
  <permissions>
  <atomic forbidden="false">
  		<user value="bob"/>
  		<role value="stagiaire"/>
  		<action name="action3"/>
  	</atomic>
	 <atomic forbidden="false">
  		<user value="alice"/>
  		<role value="patron"/>
  		<action name="action2"/>
  	</atomic>
  	<atomic forbidden="false">
  		<user value="alice"/>
  		<role value="patron"/>
  		<action name="action3"/>
  	</atomic>
  	 </permissions>
  <bans/>
  <complex>
  	<parweak>
  		<child>
  			<sod on="USER">
  				<left><atomic forbidden="false"><user value="bob" /><action name="action1" /></atomic></left>
  				<right><atomic forbidden="true"><user value="bob" /><action name="action2" /></atomic></right>
  			</sod>
  		</child>
  		<child>
  			<obl on="ROLE">
  				<left><atomic forbidden="false"><role value="patron" /><action name="action3" /></atomic></left>
  				<right><atomic forbidden="false"><role value="patron" /><action name="action4" /></atomic></right>
  			</obl>
  		</child>
  	</parweak>
  </complex>
</processus>
